{
  "$schema": "https://agent-project-os.org/schemas/organization-manifest-v1.schema.json",
  "created_at": "2026-08-18T00:00:00Z",
  "executive_roles": {"ceo": "agent:ceo", "pmo": "agent:pmo"},
  "founder": "human:example",
  "human_authority": ["production", "credentials", "funds", "permissions", "public_release", "destructive_migration", "agent_promotion"],
  "name": "Synthetic Commerce Organization",
  "organization_id": "synthetic-commerce",
  "protocol_version": "1.0",
  "updated_at": "2026-08-18T00:00:00Z"
}
